{"ApprovedToolchainHash":"8888888888888888888888888888888888888888888888888888888888888888","ArtifactKind":"current-env-state","AuthorityGeneration":1,"ControllerRepoFingerprint":"7777777777777777777777777777777777777777777777777777777777777777","DocumentHash":"abababababababababababababababababababababababababababababababab","EnvironmentLockHash":"bbbbbbbbbbbbbbbbbbbbbbbbbbbbbbbbbbbbbbbbbbbbbbbbbbbbbbbbbbbbbbbb","EnvironmentName":"full","FinalManagedHashes":[{"Hash":"4444444444444444444444444444444444444444444444444444444444444444","Platform":"Claude"},{"Hash":"5555555555555555555555555555555555555555555555555555555555555555","Platform":"Codex"},{"Hash":"6666666666666666666666666666666666666666666666666666666666666666","Platform":"Reasonix"}],"FinalResolvedIdentities":[{"DirectoryIdentity":"a1b2c3d4:0000000000000011","FilesystemCapabilityHash":"1111111111111111111111111111111111111111111111111111111111111111","LocationKey":"c:/fixture/profile/.claude/skills","Platform":"Claude","ResolvedPath":"C:\\fixture\\profile\\.claude\\skills","VolumeId":"a1b2c3d4"},{"DirectoryIdentity":"a1b2c3d4:0000000000000002","FilesystemCapabilityHash":"2222222222222222222222222222222222222222222222222222222222222222","LocationKey":"c:/fixture/profile/.codex/skills","Platform":"Codex","ResolvedPath":"C:\\fixture\\profile\\.codex\\skills","VolumeId":"a1b2c3d4"},{"DirectoryIdentity":"a1b2c3d4:0000000000000013","FilesystemCapabilityHash":"3333333333333333333333333333333333333333333333333333333333333333","LocationKey":"c:/fixture/roaming/reasonix/skills","Platform":"Reasonix","ResolvedPath":"C:\\fixture\\roaming\\reasonix\\skills","VolumeId":"a1b2c3d4"}],"FinalTargetContextHash":"f15925053f2cee6913ad73d03de32eb062fe33d11d324f557384456c3637d5a7","HomeAuthorityKey":"51def52dac407f5d051fda57a2162fb4222c17a963697e0b04bae09191fbbee7","JournalId":"22222222-2222-4222-8222-222222222222","LastOperationKind":"initial","ManifestHashes":[{"Hash":"dddddddddddddddddddddddddddddddddddddddddddddddddddddddddddddddd","Platform":"Claude"},{"Hash":"eeeeeeeeeeeeeeeeeeeeeeeeeeeeeeeeeeeeeeeeeeeeeeeeeeeeeeeeeeeeeeee","Platform":"Codex"},{"Hash":"ffffffffffffffffffffffffffffffffffffffffffffffffffffffffffffffff","Platform":"Reasonix"}],"PlanHash":"9999999999999999999999999999999999999999999999999999999999999999","PreStatePhaseHash":"cdcdcdcdcdcdcdcdcdcdcdcdcdcdcdcdcdcdcdcdcdcdcdcdcdcdcdcdcdcdcdcd","ReceiptHash":"efefefefefefefefefefefefefefefefefefefefefefefefefefefefefefefef","ReceiptId":"11111111-1111-4111-8111-111111111111","RootClaimsHash":"8cba823a8775b770b3628b230b5530c88fc92522836ae415331399dbf34c3a30","SchemaVersion":3,"SelectionKind":"environment","TaskOverlayHash":"cccccccccccccccccccccccccccccccccccccccccccccccccccccccccccccccc","TaskOverlaySkills":[{"Platform":"Claude","Skills":["alpha","beta"]},{"Platform":"Codex","Skills":["alpha"]},{"Platform":"Reasonix","Skills":[]}]}
